{
  "schemaVersion": 1,
  "id": "normalized-finding-ablation-v1",
  "status": "ratified",
  "ratifiedAt": "2026-08-02T00:00:00Z",
  "ratifiedBy": "maintainer:fixture",
  "corpusSnapshot": "fixture:normalized-finding-ablation-v1",
  "cases": [
    {
      "id": "finding-0101-01",
      "role": "manager",
      "topic": "development-0101",
      "split": "development",
      "query": "celadonquartz celadonquartzaurora?",
      "queryClass": "conceptual",
      "allowedSourceClasses": [
        "truth"
      ],
      "allowedReviewStates": [
        "manager-ratified"
      ],
      "allowedValidities": [
        "current"
      ],
      "tokenBudget": 2048,
      "expectedFindingIds": [
        "F-0101"
      ],
      "expectedFindingHandles": [
        "finding:F-0101"
      ],
      "expectedEvidenceHandles": [
        "evidence:F-0101:00acf0e6700874fa26bf"
      ],
      "expectedRawPaths": [
        "active/fixture-campaign/runs/R-20260802-0101/report.md"
      ],
      "expectedSourceClasses": {
        "F-0101": "truth"
      },
      "expectedReviewStates": {
        "F-0101": "manager-ratified"
      },
      "expectedValidities": {
        "F-0101": "current"
      },
      "hardNegativeFindingIds": [
        "F-0102"
      ],
      "answerable": true
    },
    {
      "id": "finding-0101-02",
      "role": "drafter",
      "topic": "development-0101",
      "split": "development",
      "query": "celadonquartz celadonquartzheliotrope?",
      "queryClass": "orientation",
      "allowedSourceClasses": [
        "truth"
      ],
      "allowedReviewStates": [
        "manager-ratified"
      ],
      "allowedValidities": [
        "current"
      ],
      "tokenBudget": 2048,
      "expectedFindingIds": [
        "F-0101"
      ],
      "expectedFindingHandles": [
        "finding:F-0101"
      ],
      "expectedEvidenceHandles": [
        "evidence:F-0101:00acf0e6700874fa26bf"
      ],
      "expectedRawPaths": [
        "active/fixture-campaign/runs/R-20260802-0101/report.md"
      ],
      "expectedSourceClasses": {
        "F-0101": "truth"
      },
      "expectedReviewStates": {
        "F-0101": "manager-ratified"
      },
      "expectedValidities": {
        "F-0101": "current"
      },
      "hardNegativeFindingIds": [
        "F-0102"
      ],
      "answerable": true
    },
    {
      "id": "finding-0101-03",
      "role": "manager",
      "topic": "development-0101",
      "split": "development",
      "query": "celadonquartz celadonquartzisobar?",
      "queryClass": "current",
      "allowedSourceClasses": [
        "truth"
      ],
      "allowedReviewStates": [
        "manager-ratified"
      ],
      "allowedValidities": [
        "current"
      ],
      "tokenBudget": 2048,
      "expectedFindingIds": [
        "F-0101"
      ],
      "expectedFindingHandles": [
        "finding:F-0101"
      ],
      "expectedEvidenceHandles": [
        "evidence:F-0101:00acf0e6700874fa26bf"
      ],
      "expectedRawPaths": [
        "active/fixture-campaign/runs/R-20260802-0101/report.md"
      ],
      "expectedSourceClasses": {
        "F-0101": "truth"
      },
      "expectedReviewStates": {
        "F-0101": "manager-ratified"
      },
      "expectedValidities": {
        "F-0101": "current"
      },
      "hardNegativeFindingIds": [
        "F-0102"
      ],
      "answerable": true
    },
    {
      "id": "finding-0101-04",
      "role": "drafter",
      "topic": "development-0101",
      "split": "development",
      "query": "celadonquartz celadonquartzkeystone?",
      "queryClass": "provenance",
      "allowedSourceClasses": [
        "truth"
      ],
      "allowedReviewStates": [
        "manager-ratified"
      ],
      "allowedValidities": [
        "current"
      ],
      "tokenBudget": 2048,
      "expectedFindingIds": [
        "F-0101"
      ],
      "expectedFindingHandles": [
        "finding:F-0101"
      ],
      "expectedEvidenceHandles": [
        "evidence:F-0101:00acf0e6700874fa26bf"
      ],
      "expectedRawPaths": [
        "active/fixture-campaign/runs/R-20260802-0101/report.md"
      ],
      "expectedSourceClasses": {
        "F-0101": "truth"
      },
      "expectedReviewStates": {
        "F-0101": "manager-ratified"
      },
      "expectedValidities": {
        "F-0101": "current"
      },
      "hardNegativeFindingIds": [
        "F-0102"
      ],
      "answerable": true
    },
    {
      "id": "finding-0102-01",
      "role": "manager",
      "topic": "development-0102",
      "split": "development",
      "query": "amberkeel amberkeelaurora?",
      "queryClass": "conceptual",
      "allowedSourceClasses": [
        "campaign"
      ],
      "allowedReviewStates": [
        "manager-ratified"
      ],
      "allowedValidities": [
        "challenged"
      ],
      "tokenBudget": 2048,
      "expectedFindingIds": [
        "F-0102"
      ],
      "expectedFindingHandles": [
        "finding:F-0102"
      ],
      "expectedEvidenceHandles": [
        "evidence:F-0102:6dfaa70e34941334aa61"
      ],
      "expectedRawPaths": [
        "active/fixture-campaign/runs/R-20260802-0102/report.md"
      ],
      "expectedSourceClasses": {
        "F-0102": "campaign"
      },
      "expectedReviewStates": {
        "F-0102": "manager-ratified"
      },
      "expectedValidities": {
        "F-0102": "challenged"
      },
      "hardNegativeFindingIds": [
        "F-0103"
      ],
      "answerable": true
    },
    {
      "id": "finding-0102-02",
      "role": "drafter",
      "topic": "development-0102",
      "split": "development",
      "query": "amberkeel amberkeelheliotrope?",
      "queryClass": "orientation",
      "allowedSourceClasses": [
        "campaign"
      ],
      "allowedReviewStates": [
        "manager-ratified"
      ],
      "allowedValidities": [
        "challenged"
      ],
      "tokenBudget": 2048,
      "expectedFindingIds": [
        "F-0102"
      ],
      "expectedFindingHandles": [
        "finding:F-0102"
      ],
      "expectedEvidenceHandles": [
        "evidence:F-0102:6dfaa70e34941334aa61"
      ],
      "expectedRawPaths": [
        "active/fixture-campaign/runs/R-20260802-0102/report.md"
      ],
      "expectedSourceClasses": {
        "F-0102": "campaign"
      },
      "expectedReviewStates": {
        "F-0102": "manager-ratified"
      },
      "expectedValidities": {
        "F-0102": "challenged"
      },
      "hardNegativeFindingIds": [
        "F-0103"
      ],
      "answerable": true
    },
    {
      "id": "finding-0102-03",
      "role": "manager",
      "topic": "development-0102",
      "split": "development",
      "query": "amberkeel amberkeelisobar?",
      "queryClass": "current",
      "allowedSourceClasses": [
        "campaign"
      ],
      "allowedReviewStates": [
        "manager-ratified"
      ],
      "allowedValidities": [
        "challenged"
      ],
      "tokenBudget": 2048,
      "expectedFindingIds": [
        "F-0102"
      ],
      "expectedFindingHandles": [
        "finding:F-0102"
      ],
      "expectedEvidenceHandles": [
        "evidence:F-0102:6dfaa70e34941334aa61"
      ],
      "expectedRawPaths": [
        "active/fixture-campaign/runs/R-20260802-0102/report.md"
      ],
      "expectedSourceClasses": {
        "F-0102": "campaign"
      },
      "expectedReviewStates": {
        "F-0102": "manager-ratified"
      },
      "expectedValidities": {
        "F-0102": "challenged"
      },
      "hardNegativeFindingIds": [
        "F-0103"
      ],
      "answerable": true
    },
    {
      "id": "finding-0102-04",
      "role": "drafter",
      "topic": "development-0102",
      "split": "development",
      "query": "amberkeel amberkeelkeystone?",
      "queryClass": "provenance",
      "allowedSourceClasses": [
        "campaign"
      ],
      "allowedReviewStates": [
        "manager-ratified"
      ],
      "allowedValidities": [
        "challenged"
      ],
      "tokenBudget": 2048,
      "expectedFindingIds": [
        "F-0102"
      ],
      "expectedFindingHandles": [
        "finding:F-0102"
      ],
      "expectedEvidenceHandles": [
        "evidence:F-0102:6dfaa70e34941334aa61"
      ],
      "expectedRawPaths": [
        "active/fixture-campaign/runs/R-20260802-0102/report.md"
      ],
      "expectedSourceClasses": {
        "F-0102": "campaign"
      },
      "expectedReviewStates": {
        "F-0102": "manager-ratified"
      },
      "expectedValidities": {
        "F-0102": "challenged"
      },
      "hardNegativeFindingIds": [
        "F-0103"
      ],
      "answerable": true
    },
    {
      "id": "finding-0103-01",
      "role": "manager",
      "topic": "development-0103",
      "split": "development",
      "query": "silverfen silverfenaurora?",
      "queryClass": "conceptual",
      "allowedSourceClasses": [
        "provisional"
      ],
      "allowedReviewStates": [
        "curator-checked"
      ],
      "allowedValidities": [
        "provisional"
      ],
      "tokenBudget": 2048,
      "expectedFindingIds": [
        "F-0103"
      ],
      "expectedFindingHandles": [
        "finding:F-0103"
      ],
      "expectedEvidenceHandles": [
        "evidence:F-0103:0c93510a37ed6399b4bd"
      ],
      "expectedRawPaths": [
        "active/fixture-campaign/runs/R-20260802-0103/report.md"
      ],
      "expectedSourceClasses": {
        "F-0103": "provisional"
      },
      "expectedReviewStates": {
        "F-0103": "curator-checked"
      },
      "expectedValidities": {
        "F-0103": "provisional"
      },
      "hardNegativeFindingIds": [
        "F-0104"
      ],
      "answerable": true
    },
    {
      "id": "finding-0103-02",
      "role": "drafter",
      "topic": "development-0103",
      "split": "development",
      "query": "silverfen silverfenheliotrope?",
      "queryClass": "orientation",
      "allowedSourceClasses": [
        "provisional"
      ],
      "allowedReviewStates": [
        "curator-checked"